<?xml version="1.0" encoding="UTF-8"?>
<statemaps xmlns="http://www.aditi.com"
	xmlns:xsi="http://www.w3.org/2001/XMLSchema-instance"
	xsi:schemaLocation="http://www.aditi.com StateMachine.xsd ">
	<stateConfiguration configurationName="configuration 1">
		<state>
			<statename>PartialApplication</statename>
			<stateid>7</stateid>
			<possiblestates>
				<possiblestate>
						<statename>PendingApproval</statename>
						<stateid>8</stateid>
				</possiblestate>
				<possiblestate>
					<statename>Cancel</statename>
					<stateid>11</stateid>
				</possiblestate>
			</possiblestates>
		</state>
		<state>
			<statename>Cancel</statename>
			<stateid>11</stateid>
			<possiblestates>
				<possiblestate>
						<statename>PartialApplication</statename>
						<stateid>7</stateid>
				</possiblestate>
			</possiblestates>
		</state>		
		<state>
			<statename>PendingApproval</statename>
			<stateid>8</stateid>
			<possiblestates>
				<possiblestate>
					<statename>PartialApplication</statename>
					<stateid>7</stateid>
				</possiblestate>
				<possiblestate>
					<statename>Apporved</statename>
					<stateid>9</stateid>
				</possiblestate>
				<possiblestate>
					<statename>Cancel</statename>
					<stateid>11</stateid>
				</possiblestate>
			</possiblestates>
		</state>
		<state>
			<statename>Apporved</statename>
			<stateid>9</stateid>
			<possiblestates>
				<possiblestate>
					<statename>OnHold</statename>
					<stateid>10</stateid>
				</possiblestate>
				<possiblestate>
					<statename>Closed</statename>
					<stateid>12</stateid>
				</possiblestate>
			</possiblestates>
		</state>
		<state>
			<statename>OnHold</statename>
			<stateid>10</stateid>
			<possiblestates>
				<possiblestate>
					<statename>Apporved</statename>
					<stateid>9</stateid>
				</possiblestate>
				<possiblestate>
					<statename>Closed</statename>
					<stateid>12</stateid>
				</possiblestate>
			</possiblestates>
		</state>
		<state>
			<statename>Closed</statename>
			<stateid>12</stateid>
		</state>
	</stateConfiguration>
	
		<stateConfiguration configurationName="configuration 2">
		<state>
			<statename>PartialApplication</statename>
			<stateid>7</stateid>
			<possiblestates>
				<possiblestate>
					<statename>Apporved</statename>
					<stateid>9</stateid>
				</possiblestate>
				<possiblestate>
					<statename>Cancel</statename>
					<stateid>11</stateid>
				</possiblestate>
			</possiblestates>
		</state>
		<state>
			<statename>Cancel</statename>
			<stateid>11</stateid>
			<possiblestates>
				<possiblestate>
						<statename>PartialApplication</statename>
						<stateid>7</stateid>
				</possiblestate>
			</possiblestates>
		</state>
		<state>
			<statename>Apporved</statename>
			<stateid>9</stateid>
			<possiblestates>
				<possiblestate>
					<statename>OnHold</statename>
					<stateid>10</stateid>
				</possiblestate>
				<possiblestate>
					<statename>Closed</statename>
					<stateid>12</stateid>
				</possiblestate>
			</possiblestates>
		</state>
		<state>
			<statename>OnHold</statename>
			<stateid>10</stateid>
			<possiblestates>
				<possiblestate>
					<statename>Apporved</statename>
					<stateid>9</stateid>
				</possiblestate>
				<possiblestate>
					<statename>Closed</statename>
					<stateid>12</stateid>
				</possiblestate>
			</possiblestates>
		</state>
		<state>
			<statename>Closed</statename>
			<stateid>12</stateid>
		</state>
	</stateConfiguration>
</statemaps>