<?xml version="1.0" encoding="UTF-8"?>
<statemaps xmlns="http://www.aditi.com" xmlns:xsi="http://www.w3.org/2001/XMLSchema-instance" xsi:schemaLocation="http://www.aditi.com StateMachine.xsd ">
	<stateConfiguration configurationName="configuration 1">
		<state>
			<statename>PartialApplication</statename>
			<stateid>1</stateid>
			<possiblestates>
				<possiblestate>
					<statename>PendingApproval</statename>
					<stateid>2</stateid>
				</possiblestate>
				<possiblestate>
					<statename>Cancel</statename>
					<stateid>10</stateid>
				</possiblestate>
			</possiblestates>
		</state>
		<state>
			<statename>Cancel</statename>
			<stateid>10</stateid>
		</state>
		<state>
			<statename>PendingApproval</statename>
			<stateid>2</stateid>
			<possiblestates>
				<possiblestate>
					<statename>PartialApplication</statename>
					<stateid>1</stateid>
				</possiblestate>
				<possiblestate>
					<statename>Apporved</statename>
					<stateid>3</stateid>
				</possiblestate>
				<possiblestate>
					<statename>DBtoLoanOfficer</statename>
					<stateid>4</stateid>
				</possiblestate>
				<possiblestate>
					<statename>Cancel</statename>
					<stateid>10</stateid>
				</possiblestate>
			</possiblestates>
		</state>
		<state>
			<statename>Apporved</statename>
			<stateid>3</stateid>
			<possiblestates>
				<possiblestate>
					<statename>DBtoLoanOfficer</statename>
					<stateid>4</stateid>
				</possiblestate>
				<possiblestate>
					<statename>Cancel</statename>
					<stateid>10</stateid>
				</possiblestate>
			</possiblestates>
		</state>
		<state>
			<statename>DBtoLoanOfficer</statename>
			<stateid>4</stateid>
			<possiblestates>
				<possiblestate>
					<statename>Cancel</statename>
					<stateid>10</stateid>
				</possiblestate>
			</possiblestates>
		</state>
		<state>
			<statename>ActiveInGoodStanding</statename>
			<stateid>5</stateid>
			<possiblestates>
				<possiblestate>
					<statename>Rescheduled</statename>
					<stateid>8</stateid>
				</possiblestate>
				<possiblestate>
					<statename>WrittenOff</statename>
					<stateid>7</stateid>
				</possiblestate>
			</possiblestates>
		</state>
		<state>
			<statename>ActiveInBadStanding</statename>
			<stateid>9</stateid>
			<possiblestates>
				<possiblestate>
					<statename>Rescheduled</statename>
					<stateid>8</stateid>
				</possiblestate>
				<possiblestate>
					<statename>WrittenOff</statename>
					<stateid>7</stateid>
				</possiblestate>
			</possiblestates>
		</state>
	</stateConfiguration>

	<stateConfiguration configurationName="configuration 2">
		<state>
			<statename>PartialApplication</statename>
			<stateid>1</stateid>
			<possiblestates>
				<possiblestate>
					<statename>Apporved</statename>
					<stateid>3</stateid>
				</possiblestate>
				<possiblestate>
					<statename>Cancel</statename>
					<stateid>10</stateid>
				</possiblestate>
			</possiblestates>
		</state>
		<state>
			<statename>Cancel</statename>
			<stateid>10</stateid>
		</state>
		<state>
			<statename>Apporved</statename>
			<stateid>3</stateid>
			<possiblestates>
				<possiblestate>
					<statename>DBtoLoanOfficer</statename>
					<stateid>4</stateid>
				</possiblestate>
				<possiblestate>
					<statename>Cancel</statename>
					<stateid>10</stateid>
				</possiblestate>
			</possiblestates>
		</state>
		<state>
			<statename>DBtoLoanOfficer</statename>
			<stateid>4</stateid>
			<possiblestates>
				<possiblestate>
					<statename>Cancel</statename>
					<stateid>10</stateid>
				</possiblestate>
			</possiblestates>
		</state>
		<state>
			<statename>ActiveInGoodStanding</statename>
			<stateid>5</stateid>
			<possiblestates>
				<possiblestate>
					<statename>Rescheduled</statename>
					<stateid>8</stateid>
				</possiblestate>
				<possiblestate>
					<statename>WrittenOff</statename>
					<stateid>7</stateid>
				</possiblestate>
			</possiblestates>
		</state>
		<state>
			<statename>ActiveInBadStanding</statename>
			<stateid>9</stateid>
			<possiblestates>
				<possiblestate>
					<statename>Rescheduled</statename>
					<stateid>8</stateid>
				</possiblestate>
				<possiblestate>
					<statename>WrittenOff</statename>
					<stateid>7</stateid>
				</possiblestate>
			</possiblestates>
		</state>
	</stateConfiguration>
	<stateConfiguration configurationName="configuration 3">
		<state>
			<statename>PartialApplication</statename>
			<stateid>1</stateid>
			<possiblestates>
				<possiblestate>
					<statename>PendingApproval</statename>
					<stateid>2</stateid>
				</possiblestate>
				<possiblestate>
					<statename>Cancel</statename>
					<stateid>10</stateid>
				</possiblestate>
			</possiblestates>
		</state>
		<state>
			<statename>Cancel</statename>
			<stateid>10</stateid>
		</state>
		<state>
			<statename>PendingApproval</statename>
			<stateid>2</stateid>
			<possiblestates>
				<possiblestate>
					<statename>PartialApplication</statename>
					<stateid>1</stateid>
				</possiblestate>
				<possiblestate>
					<statename>Apporved</statename>
					<stateid>3</stateid>
				</possiblestate>
				<possiblestate>
					<statename>Cancel</statename>
					<stateid>10</stateid>
				</possiblestate>
			</possiblestates>
		</state>
		<state>
			<statename>Apporved</statename>
			<stateid>3</stateid>
			<possiblestates>
				<possiblestate>
					<statename>Cancel</statename>
					<stateid>10</stateid>
				</possiblestate>
			</possiblestates>
		</state>
		<state>
			<statename>ActiveInGoodStanding</statename>
			<stateid>5</stateid>
			<possiblestates>
				<possiblestate>
					<statename>Rescheduled</statename>
					<stateid>8</stateid>
				</possiblestate>
				<possiblestate>
					<statename>WrittenOff</statename>
					<stateid>7</stateid>
				</possiblestate>
			</possiblestates>
		</state>
		<state>
			<statename>ActiveInBadStanding</statename>
			<stateid>9</stateid>
			<possiblestates>
				<possiblestate>
					<statename>Rescheduled</statename>
					<stateid>8</stateid>
				</possiblestate>
				<possiblestate>
					<statename>WrittenOff</statename>
					<stateid>7</stateid>
				</possiblestate>
			</possiblestates>
		</state>
	</stateConfiguration>
	<stateConfiguration configurationName="configuration 4">
		<state>
			<statename>PartialApplication</statename>
			<stateid>1</stateid>
			<possiblestates>
				<possiblestate>
					<statename>Apporved</statename>
					<stateid>3</stateid>
				</possiblestate>
				<possiblestate>
					<statename>Cancel</statename>
					<stateid>10</stateid>
				</possiblestate>
			</possiblestates>
		</state>
		<state>
			<statename>Cancel</statename>
			<stateid>10</stateid>
		</state>
		<state>
			<statename>Apporved</statename>
			<stateid>3</stateid>
			<possiblestates>
				<possiblestate>
					<statename>Cancel</statename>
					<stateid>10</stateid>
				</possiblestate>
			</possiblestates>
		</state>
		<state>
			<statename>ActiveInGoodStanding</statename>
			<stateid>5</stateid>
			<possiblestates>
				<possiblestate>
					<statename>Rescheduled</statename>
					<stateid>8</stateid>
				</possiblestate>
				<possiblestate>
					<statename>WrittenOff</statename>
					<stateid>7</stateid>
				</possiblestate>
			</possiblestates>
		</state>
		<state>
			<statename>ActiveInBadStanding</statename>
			<stateid>9</stateid>
			<possiblestates>
				<possiblestate>
					<statename>Rescheduled</statename>
					<stateid>8</stateid>
				</possiblestate>
				<possiblestate>
					<statename>WrittenOff</statename>
					<stateid>7</stateid>
				</possiblestate>
			</possiblestates>
		</state>
	</stateConfiguration>
</statemaps>
